{
  "schema_version": "1.0.0",
  "engine_version": "0.4.0",
  "session_id": "example-only",
  "mod": {
    "id": "mirror_delivery",
    "version": "1.0.0",
    "title": "Mirror Delivery"
  },
  "turn": 0,
  "master_seed": "example-seed",
  "rng_streams": {},
  "world_state": {
    "location": "cislunar_exchange",
    "epoch": 2189,
    "tension": 2.4,
    "momentum": 0,
    "ambient_hazard_rate": 0.008,
    "world_time_minutes": 0,
    "mirror_payload_status": "sealed_pristine",
    "mirror_activation_count": 0,
    "mirror_divergent": false,
    "mirror_alias": "Mir"
  },
  "characters": {},
  "relationships": {},
  "quests": {},
  "beliefs": {},
  "facts": {
    "revealed": [],
    "hidden_ids": []
  },
  "open_threads": [],
  "long_term_consequences": [],
  "chronicle": [],
  "event_ledger": [],
  "image_jobs": [],
  "summaries": {
    "working": "",
    "long_term": ""
  }
}
